{
  "brief_id": "v2_09_deepfake_election_risk",
  "video_title": "Deepfake election risk is becoming a platform crisis",
  "episode_headline": "AI-generated political media forces platforms to choose speed or accuracy.",
  "topic": "culture",
  "main_subjects": [
    {
      "type": "object",
      "name": "deepfake video",
      "importance": "primary",
      "visual_priority": 5
    },
    {
      "type": "organization",
      "name": "social platform",
      "importance": "secondary",
      "visual_priority": 4
    },
    {
      "type": "event",
      "name": "election cycle",
      "importance": "context",
      "visual_priority": 4
    }
  ],
  "story_angle": "A media and trust story about synthetic video, political misinformation, and moderation speed.",
  "emotion": "urgent",
  "stakes": "The trust layer of news and politics is being stress-tested.",
  "curiosity_gap": "Can platforms catch fake political media before it moves votes?",
  "key_numbers": [
    {
      "label": "Trust risk",
      "value": "FAKE?",
      "confidence": "reported"
    }
  ],
  "approved_thumbnail_text": [
    "deepfake election risk",
    "fake video panic",
    "trust breaks"
  ],
  "assets": {
    "person_images": [],
    "logos": [],
    "background_images": [],
    "maps": [],
    "screenshots": [],
    "documents": [],
    "objects": [
      {
        "id": "v2_deepfake_warning_screen",
        "path_or_url": "assets/thumbnails/generated/topic_showcase_v2/deepfake_warning_screen.png",
        "type": "hero_composite",
        "subject_name": "deepfake warning screen synthetic media election trust risk",
        "license": "Generated local test asset",
        "usage_status": "approved",
        "label": "Deepfake warning screen"
      },
      {
        "id": "generated_topic_showcase_v2_deepfake_warning_screen",
        "path_or_url": "assets/thumbnails/generated/topic_showcase_v2/deepfake_warning_screen.png",
        "type": "hero_composite",
        "subject_name": "deepfake warning screen",
        "license": "AI-generated project asset",
        "usage_status": "approved",
        "label": "Auto-discovered generated composite"
      }
    ]
  },
  "render_preferences": {
    "candidate_count": 3,
    "preferred_templates": [
      "clean_market_surge",
      "authority_warning",
      "logo_collision"
    ],
    "brand_intensity": "standard",
    "allow_symbolic_generated_background": true,
    "allow_real_person_generation": false
  },
  "compliance": {
    "must_use_only_approved_assets": false,
    "requires_human_review": true,
    "notes": "Auto-resolved by SynthPost thumbnail asset selector."
  }
}
