{
  "brief_id": "topic_showcase_us_china_chip_race",
  "video_title": "The US-China AI Chip Race Is Escalating",
  "episode_headline": "Export controls and AI compute demand are turning chips into strategic leverage.",
  "topic": "geopolitics",
  "main_subjects": [
    {
      "type": "country",
      "name": "United States",
      "importance": "primary",
      "visual_priority": 5
    },
    {
      "type": "country",
      "name": "China",
      "importance": "primary",
      "visual_priority": 5
    },
    {
      "type": "object",
      "name": "AI chip",
      "importance": "context",
      "visual_priority": 5
    }
  ],
  "story_angle": "AI compute becomes the center of a global power contest.",
  "emotion": "urgent",
  "stakes": "The chip supply chain is now a geopolitical pressure point.",
  "curiosity_gap": "Who controls the next generation of AI compute?",
  "key_numbers": [],
  "approved_thumbnail_text": [
    "chip war escalates",
    "ai race heats up",
    "compute becomes power"
  ],
  "forbidden_thumbnail_text": [],
  "assets": {
    "person_images": [],
    "logos": [],
    "background_images": [],
    "maps": [],
    "screenshots": [],
    "documents": [],
    "objects": [
      {
        "id": "us_china_chip_race_composite",
        "path_or_url": "assets/thumbnails/generated/topic_showcase/us_china_chip_race.png",
        "type": "hero_composite",
        "subject_name": "AI chip, geopolitical panels, map lines, and motion streaks",
        "label": "AI-generated combined foreground",
        "usage_status": "approved",
        "license": "AI-generated project asset"
      }
    ]
  },
  "render_preferences": {
    "candidate_count": 3,
    "preferred_templates": [
      "clean_market_surge"
    ],
    "brand_intensity": "standard",
    "allow_symbolic_generated_background": true,
    "allow_real_person_generation": false
  },
  "compliance": {
    "must_use_only_approved_assets": false,
    "requires_human_review": true,
    "notes": "Topic showcase generated composite for layout evaluation."
  }
}
