{
  "brief_id": "v2_06_quantum_security_clock",
  "video_title": "Quantum security is becoming a real boardroom problem",
  "episode_headline": "Quantum computers threaten old encryption as companies race to upgrade security.",
  "topic": "technology",
  "main_subjects": [
    {"type": "object", "name": "quantum computer", "importance": "primary", "visual_priority": 5},
    {"type": "object", "name": "encryption lock", "importance": "secondary", "visual_priority": 5},
    {"type": "company", "name": "cloud security", "importance": "context", "visual_priority": 3}
  ],
  "story_angle": "A cybersecurity explainer about post-quantum encryption, infrastructure risk, and timing.",
  "emotion": "mysterious",
  "stakes": "Security upgrades may need to happen before quantum machines fully arrive.",
  "curiosity_gap": "Why are companies preparing for a threat that is not fully here yet?",
  "key_numbers": [
    {"label": "Security clock", "value": "Q-DAY", "confidence": "estimated"}
  ],
  "approved_thumbnail_text": ["quantum breaks locks", "Q-day countdown", "encryption panic"],
  "forbidden_thumbnail_text": [],
  "assets": {
    "person_images": [],
    "logos": [],
    "background_images": [],
    "maps": [],
    "screenshots": [],
    "documents": [],
    "objects": [
      {
        "id": "v2_quantum_encryption_lock",
        "path_or_url": "assets/thumbnails/generated/topic_showcase_v2/quantum_encryption_lock.png",
        "type": "hero_composite",
        "subject_name": "quantum computer encryption lock post quantum security",
        "label": "Quantum encryption lock",
        "usage_status": "approved",
        "license": "Generated local test asset"
      }
    ]
  },
  "render_preferences": {
    "candidate_count": 3,
    "preferred_templates": ["clean_market_surge", "logo_collision", "authority_warning"],
    "brand_intensity": "standard",
    "allow_symbolic_generated_background": true,
    "allow_real_person_generation": false
  }
}
