{
  "brief_id": "template_preview_clean_market_surge",
  "video_title": "Nvidia Stock Surges After Explosive GPU Demand",
  "episode_headline": "Nvidia shares jump as AI GPU demand keeps pushing the market higher.",
  "topic": "finance",
  "main_subjects": [
    {
      "type": "person",
      "name": "Jensen Huang",
      "role": "Nvidia CEO",
      "importance": "primary",
      "visual_priority": 5
    },
    {
      "type": "company",
      "name": "Nvidia",
      "importance": "secondary",
      "visual_priority": 4
    },
    {
      "type": "object",
      "name": "GPU",
      "importance": "context",
      "visual_priority": 4
    }
  ],
  "story_angle": "A celebrity CEO plus a symbolic GPU and upward market motion explain why Nvidia is surging.",
  "emotion": "optimistic",
  "stakes": "AI hardware demand keeps driving market momentum.",
  "curiosity_gap": "How much of the rally is still tied to GPU scarcity?",
  "key_numbers": [
    {
      "label": "Ticker",
      "value": "NVDA",
      "confidence": "reported"
    }
  ],
  "approved_thumbnail_text": [
    "nvidia stock surges",
    "gpu demand explodes",
    "jensen's ai rally"
  ],
  "forbidden_thumbnail_text": [],
  "assets": {
    "person_images": [],
    "logos": [],
    "background_images": [],
    "maps": [],
    "screenshots": [],
    "documents": [],
    "objects": [
      {
        "id": "nvidia_hero_composite",
        "path_or_url": "assets/thumbnails/generated/clean_market_surge/nvidia_hero_composite.png",
        "type": "hero_composite",
        "subject_name": "Jensen Huang, GPU, market arrow, and motion streaks",
        "label": "AI-generated combined foreground",
        "usage_status": "approved",
        "license": "AI-generated project asset"
      },
      {
        "id": "gpu_symbolic_prop",
        "path_or_url": "generated://gpu",
        "type": "object",
        "subject_name": "GPU",
        "label": "RTX 4090",
        "usage_status": "approved",
        "license": "generated symbolic prop"
      }
    ]
  },
  "render_preferences": {
    "candidate_count": 3,
    "preferred_templates": [
      "clean_market_surge",
      "money_deal_bomb",
      "logo_collision"
    ],
    "brand_intensity": "standard",
    "allow_symbolic_generated_background": true,
    "allow_real_person_generation": false
  },
  "compliance": {
    "must_use_only_approved_assets": false,
    "requires_human_review": true,
    "notes": "Preview uses generated fallback initials and GPU prop until approved Jensen/GPU cutouts are available."
  }
}
