{
  "brief_id": "v2_05_robot_labor_shift",
  "video_title": "The humanoid robot labor shift is arriving faster than expected",
  "episode_headline": "Robots enter the factory floor as companies rethink labor costs.",
  "topic": "technology",
  "main_subjects": [
    {
      "type": "object",
      "name": "humanoid robot",
      "importance": "primary",
      "visual_priority": 5
    },
    {
      "type": "company",
      "name": "factory operator",
      "importance": "secondary",
      "visual_priority": 3
    },
    {
      "type": "place",
      "name": "warehouse floor",
      "importance": "context",
      "visual_priority": 3
    }
  ],
  "story_angle": "A technology and labor-market story about automation moving from demos to deployment.",
  "emotion": "serious",
  "stakes": "The first real automation wave may arrive through warehouses and factories.",
  "curiosity_gap": "Which jobs change first when robots leave the demo stage?",
  "key_numbers": [
    {
      "label": "Deployment phase",
      "value": "LIVE",
      "confidence": "reported"
    }
  ],
  "approved_thumbnail_text": [
    "robots enter work",
    "labor shift begins",
    "factory jobs change"
  ],
  "assets": {
    "person_images": [],
    "logos": [],
    "background_images": [],
    "maps": [],
    "screenshots": [],
    "documents": [],
    "objects": [
      {
        "id": "robot_labor_shift_composite",
        "path_or_url": "assets/thumbnails/generated/topic_showcase/robot_labor_shift.png",
        "type": "hero_composite",
        "subject_name": "robot automation labor jobs technology",
        "license": "AI-generated project asset",
        "usage_status": "approved",
        "label": "Robot labor shift composite"
      }
    ]
  },
  "render_preferences": {
    "candidate_count": 3,
    "preferred_templates": [
      "authority_warning",
      "logo_collision",
      "money_deal_bomb"
    ],
    "brand_intensity": "standard",
    "allow_symbolic_generated_background": true,
    "allow_real_person_generation": false
  },
  "compliance": {
    "must_use_only_approved_assets": false,
    "requires_human_review": true,
    "notes": "Auto-resolved by SynthPost thumbnail asset selector."
  }
}
