{
  "brief_id": "v2_10_satellite_internet_race",
  "video_title": "The satellite internet race is becoming a geopolitical infrastructure fight",
  "episode_headline": "Orbital networks turn internet access into a strategic global asset.",
  "topic": "infrastructure",
  "main_subjects": [
    {
      "type": "object",
      "name": "satellite constellation",
      "importance": "primary",
      "visual_priority": 5
    },
    {
      "type": "country",
      "name": "global south",
      "importance": "secondary",
      "visual_priority": 3
    },
    {
      "type": "company",
      "name": "orbital network",
      "importance": "context",
      "visual_priority": 4
    }
  ],
  "story_angle": "An infrastructure and geopolitics story about internet access, orbital networks, and strategic leverage.",
  "emotion": "serious",
  "stakes": "Connectivity is becoming national infrastructure above the atmosphere.",
  "curiosity_gap": "Who controls internet access when the network is in orbit?",
  "key_numbers": [
    {
      "label": "Coverage race",
      "value": "GLOBAL",
      "confidence": "reported"
    }
  ],
  "approved_thumbnail_text": [
    "internet moves orbit",
    "satellite power shift",
    "orbital network race"
  ],
  "assets": {
    "person_images": [],
    "logos": [],
    "background_images": [],
    "maps": [],
    "screenshots": [],
    "documents": [],
    "objects": [
      {
        "id": "v2_satellite_orbital_network",
        "path_or_url": "assets/thumbnails/generated/topic_showcase_v2/satellite_orbital_network.png",
        "type": "hero_composite",
        "subject_name": "satellite orbital network internet constellation global coverage",
        "license": "Generated local test asset",
        "usage_status": "approved",
        "label": "Satellite orbital network"
      },
      {
        "id": "generated_topic_showcase_v2_satellite_orbital_network",
        "path_or_url": "assets/thumbnails/generated/topic_showcase_v2/satellite_orbital_network.png",
        "type": "hero_composite",
        "subject_name": "satellite orbital network",
        "license": "AI-generated project asset",
        "usage_status": "approved",
        "label": "Auto-discovered generated composite"
      }
    ]
  },
  "render_preferences": {
    "candidate_count": 3,
    "preferred_templates": [
      "clean_market_surge",
      "logo_collision",
      "money_deal_bomb"
    ],
    "brand_intensity": "standard",
    "allow_symbolic_generated_background": true,
    "allow_real_person_generation": false
  },
  "compliance": {
    "must_use_only_approved_assets": false,
    "requires_human_review": true,
    "notes": "Auto-resolved by SynthPost thumbnail asset selector."
  }
}
